{
    "$schema": "./tariffs.schema.json",
    "earnie_data_model": 4,
    "catalog_as_of": "2026-09-28",
    "oemag_monthly_feed_in_rates": [
        {
            "year": 2025,
            "month": 1,
            "tariff_cent_kwh": 9.73
        },
        {
            "year": 2025,
            "month": 2,
            "tariff_cent_kwh": 9.73
        },
        {
            "year": 2025,
            "month": 3,
            "tariff_cent_kwh": 6.007
        },
        {
            "year": 2025,
            "month": 4,
            "tariff_cent_kwh": 5.855
        },
        {
            "year": 2025,
            "month": 5,
            "tariff_cent_kwh": 5.855
        },
        {
            "year": 2025,
            "month": 6,
            "tariff_cent_kwh": 5.855
        },
        {
            "year": 2025,
            "month": 7,
            "tariff_cent_kwh": 5.965
        },
        {
            "year": 2025,
            "month": 8,
            "tariff_cent_kwh": 5.892
        },
        {
            "year": 2025,
            "month": 9,
            "tariff_cent_kwh": 5.892
        },
        {
            "year": 2025,
            "month": 10,
            "tariff_cent_kwh": 9.008
        },
        {
            "year": 2025,
            "month": 11,
            "tariff_cent_kwh": 9.167
        },
        {
            "year": 2025,
            "month": 12,
            "tariff_cent_kwh": 9.167
        },
        {
            "year": 2026,
            "month": 1,
            "tariff_cent_kwh": 8.842
        },
        {
            "year": 2026,
            "month": 2,
            "tariff_cent_kwh": 8.457
        },
        {
            "year": 2026,
            "month": 3,
            "tariff_cent_kwh": 5.72
        },
        {
            "year": 2026,
            "month": 4,
            "tariff_cent_kwh": 6.772
        },
        {
            "year": 2026,
            "month": 5,
            "tariff_cent_kwh": 6.772
        },
        {
            "year": 2026,
            "month": 6,
            "tariff_cent_kwh": 6.772
        },
        {
            "year": 2026,
            "month": 7,
            "tariff_cent_kwh": 6.146
        },
        {
            "year": 2026,
            "month": 8,
            "tariff_cent_kwh": 8.997
        },
        {
            "year": 2026,
            "month": 9,
            "tariff_cent_kwh": 10.168
        }
    ],
    "monthly_float_reference_cent_kwh": 7.15,
    "import_tariffs": [
        {
            "id": "at_tiwag_flex_privat",
            "label": "TIWAG — flex privat",
            "type": "spot_hourly",
            "land": "AT",
            "currency": "EUR",
            "settlement_fee_cent_kwh": 1.2,
            "markup_percent": 0.0,
            "prices_include_vat": false,
            "vat_percent": 20.0,
            "settlement_mtu": "15min",
            "notes": "Viertelstuendliche Neufestsetzung des Arbeitspreises je EPEX Spot AT Day-Ahead-Viertelstunde. Quelle: tiwag.at Produkt- und Preisblatt, gueltig ab 01.10.2025.",
            "supplier_id": "tiwag"
        },
        {
            "id": "at_aae_naturstrom_naturstrom_spot_stunde_ii",
            "label": "AAE NATURSTROM — Naturstrom SPOT Stunde II",
            "type": "spot_hourly",
            "land": "AT",
            "currency": "EUR",
            "settlement_fee_cent_kwh": 1.3,
            "markup_percent": 0.0,
            "prices_include_vat": false,
            "vat_percent": 20.0,
            "settlement_mtu": "15min",
            "notes": "Trotz \"Stunde\" im Produktnamen: Abrechnungsformel ist EPEX SPOT AT 1/4-Stundenpreis x Verbrauch je Viertelstunde; nur die Rechnungsdarstellung zeigt einen aufsummierten Durchschnittspreis. Quelle: aae.at Preisblatt Naturstrom SPOT Stunde II V2, gueltig ab 07.10.2025.",
            "supplier_id": "aae_naturstrom"
        },
        {
            "id": "at_pullstrom_pullstrom_ora",
            "label": "pullstrom — Pullstrom ORA",
            "type": "spot_hourly",
            "land": "AT",
            "currency": "EUR",
            "settlement_fee_cent_kwh": 1.3333,
            "markup_percent": 0.0,
            "prices_include_vat": false,
            "vat_percent": 20.0,
            "settlement_mtu": "60min",
            "notes": "Echt stuendlich abgerechnet (\"Stuendlicher Arbeitspreis = EPEX SPOT AT Day-Ahead + Handlingfee\"), auch nach der QH-Umstellung beibehalten. Quelle: pullstrom.at Preisblatt ORA, Stand 04.11.2025.",
            "supplier_id": "pullstrom"
        },
        {
            "id": "at_smartenergy_smartcontrol",
            "label": "smartENERGY — smartCONTROL",
            "type": "spot_hourly",
            "land": "AT",
            "currency": "EUR",
            "settlement_fee_cent_kwh": 1.2,
            "markup_percent": 0.0,
            "prices_include_vat": false,
            "vat_percent": 20.0,
            "monthly_fee_eur": 2.49,
            "settlement_mtu": "60min",
            "notes": "Energiepreis wird stuendlich angepasst (P stuendlich = EPEX Spot AT + Abwicklungsgebuehr); Messung 15-min (IME), Abrechnung aber echt stuendlich. Quelle: smartenergy.at/smartcontrol + Kundeninformation und Preisblatt smartCONTROL.",
            "supplier_id": "smartenergy"
        },
        {
            "id": "at_oekostrom_oeko_spot",
            "label": "oekostrom — oeko Spot+",
            "type": "spot_hourly",
            "land": "AT",
            "currency": "EUR",
            "settlement_fee_cent_kwh": 1.5,
            "markup_percent": 0.0,
            "prices_include_vat": false,
            "vat_percent": 20.0,
            "settlement_mtu": "15min",
            "notes": "\"Tarif mit viertelstuendlicher Abrechnung zum Boersenpreis\", explizit von der stuendlich abgerechneten Einspeisung abgegrenzt. Quelle: oekostrom.at/spot-preis/.",
            "supplier_id": "oekostrom"
        },
        {
            "id": "at_spotty_smart_active",
            "label": "Spotty — Smart Active",
            "type": "spot_hourly",
            "land": "AT",
            "currency": "EUR",
            "settlement_fee_cent_kwh": 1.49,
            "markup_percent": 0.0,
            "prices_include_vat": false,
            "vat_percent": 20.0,
            "monthly_fee_eur": 2.0,
            "settlement_mtu": "15min",
            "notes": "Umstellung auf echte Viertelstundenabrechnung (\"96 Viertelstundenpreise\") per Oktober 2025 vom Anbieter selbst angekuendigt. Quelle: spottyenergie.at/blog/strommarkt-update-oktober-25.",
            "supplier_id": "spotty"
        },
        {
            "id": "at_energie_steiermark_e1_floater",
            "label": "Energie Steiermark — E1 Floater",
            "type": "spot_hourly",
            "land": "AT",
            "currency": "EUR",
            "settlement_fee_cent_kwh": 1.2,
            "markup_percent": 0.0,
            "prices_include_vat": false,
            "vat_percent": 20.0,
            "notes": "settlement_mtu unverifiziert (Recherche 2026-08-14): kein \"E1 Floater\"-Tarif der Energie Steiermark auffindbar; \"E1 Floater\" scheint zu E1 Erste Energie/First Energy AG (CH, unabhaengiges Unternehmen) zu gehoeren, deren Preisblatt inzwischen 404. Energie Steiermarks eigener Spot-Tarif heisst \"SteirerStrom Spot\" (siehe at_energie_steiermark_first_energy_steirerstrom_spot, stuendlich). Moeglicher Supplier-/ID-Mismatch — vor Verwendung Tarif-Zuordnung pruefen. Default 15min unveraendert, aber nicht belastbar.",
            "supplier_id": "energie_steiermark"
        },
        {
            "id": "at_elektrizitaetswerk_perg_heimatstrom_spot",
            "label": "Elektrizitaetswerk Perg — HeimatStrom SPOT",
            "type": "spot_hourly",
            "land": "AT",
            "currency": "EUR",
            "settlement_fee_cent_kwh": 1.6,
            "markup_percent": 0.0,
            "prices_include_vat": false,
            "vat_percent": 20.0,
            "settlement_mtu": "15min",
            "notes": "\"Arbeitspreis aendert sich 96-mal am Tag\" (viertelstuendlicher SPOT-Preis + Handling Fee). Quelle: ewerk-perg.at Preisblatt HeimatstromSPOT, gueltig ab 01.01.2026.",
            "supplier_id": "elektrizitaetswerk_perg"
        },
        {
            "id": "at_hofer_gruenstrom_hofer_gruenstrom_spot",
            "label": "HOFER GRUENSTROM — HOFER GRUENSTROM SPOT",
            "type": "spot_hourly",
            "land": "AT",
            "currency": "EUR",
            "settlement_fee_cent_kwh": 1.5833,
            "markup_percent": 0.0,
            "prices_include_vat": false,
            "vat_percent": 20.0,
            "settlement_mtu": "15min",
            "notes": "\"Viertelstuendlich variabler Strompreis, der sich an den aktuellen Boersenpreisen orientiert.\" Quelle: hofer-gruenstrom.at Produktseite HOFER GRUENSTROM SPOT.",
            "supplier_id": "hofer_gruenstrom"
        },
        {
            "id": "at_verbund_v_strom_spot",
            "label": "Verbund — V-Strom SPOT",
            "type": "spot_hourly",
            "land": "AT",
            "currency": "EUR",
            "settlement_fee_cent_kwh": 1.3,
            "markup_percent": 4.0,
            "prices_include_vat": false,
            "vat_percent": 20.0,
            "monthly_fee_eur": 3.99,
            "settlement_mtu": "15min",
            "notes": "Monatsgebuehr ca. 3,99 EUR netto / 4,79 EUR brutto (Naeherung). Volumetrische Formel (1,3 ct + 4% Markup) vs. Anbieter-Tarifblatt noch zu klaeren. settlement_mtu: \"Viertelstuendliche Energiepreise der EPEX SPOT SE\". Quelle: Verbund Produkt- und Informationsblatt Strom-SPOT V-Strom-SPOT-G-KW4925, Stand Dezember 2025.",
            "supplier_id": "verbund"
        },
        {
            "id": "at_wuesterstrom_wuesterstrom_spot",
            "label": "wuesterstrom — wuesterstrom Spot",
            "type": "spot_hourly",
            "land": "AT",
            "currency": "EUR",
            "settlement_fee_cent_kwh": 1.5,
            "markup_percent": 0.0,